New Summary ID,Narrative Element,Page,Section / Component,Name,Combined Name,Length,Purpose,Example,# DataPoints
74,Market Comp,Market Comp Detail Page,Comparison - Plot Compared,Similarities,Market Comp Detail Page- Comparison - Plot Compared- Similarities,1 sentence,Highlight a key plot parallel or structural echo between the stories.,"In each, the protagonist must navigate a web of corporate espionage and shifting allegiances to uncover the truth.",2
75,Market Comp,Market Comp Detail Page,Comparison - Plot Compared,Differences,Market Comp Detail Page- Comparison - Plot Compared- Differences,1 sentence,Identify a major plot distinction that sets the current story apart.,"While the comp builds to a single reality-redefining twist, this story features multiple nested revelations that keep reframing the characters' mission.",2
76,Market Comp,Market Comp Detail Page,Comparison - Characters,Key Character Item,Market Comp Detail Page- Comparison - Characters- Key Character Item,1 sentence,Identify a major player in the comp who drives the narrative.,"The jaded mercenary, haunted by a dark past, reluctantly teams up with the naive hacker to unravel the conspiracy.",2
77,Market Comp,Market Comp Detail Page,Comparison - Characters,Character Arcs,Market Comp Detail Page- Comparison - Characters- Character Arcs,1 sentence,Summarize a key character arc and its impact on the comp's story.,The mercenary's journey from cynical loner to self-sacrificing hero forms the emotional spine of the narrative.,2
78,Market Comp,Market Comp Detail Page,Comparison - Characters,Characters Compared,Market Comp Detail Page- Comparison - Characters- Characters Compared,1 sentence,Identify similar character archetypes or roles shared with the current story.,Both stories feature an odd couple pairing of a grizzled veteran and an idealistic rookie who challenge each other's worldviews.,1
79,Market Comp,Market Comp Detail Page,Comparison - Characters - Characters Compared,Similarities,Market Comp Detail Page- Comparison - Characters - Characters Compared- Similarities,1 sentence,Highlight a key character parallel between the stories.,"In each, a jaded warrior figure must confront their past and learn to trust again through an unlikely partnership.",2
80,Market Comp,Market Comp Detail Page,Comparison - Characters - Characters Compared,Differences,Market Comp Detail Page- Comparison - Characters - Characters Compared- Differences,1 sentence,Identify a major character distinction that sets the current story apart.,"While the comp's hacker is a wide-eyed ingenue, the current story's rookie is a traumatized survivor seeking justice.",2
81,Market Comp,Market Comp Detail Page,Comparison - Themes,Central Themes,Market Comp Detail Page- Comparison - Themes- Central Themes,1 sentence,Identify the comp's core thematic questions and concerns.,"The story explores the nature of reality, identity, and free will in a world where the virtual and the real are increasingly blurred.",1
82,Market Comp,Market Comp Detail Page,Comparison - Themes,Symbols & Motifs Item,Market Comp Detail Page- Comparison - Themes- Symbols & Motifs Item,1 sentence,Highlight a recurring symbol or motif that encapsulates the comp's themes.,"The ever-present neon glow that suffuses the city, both mesmerizing and obscuring, mirrors the allure and peril of living in virtual realities.",2
83,Market Comp,Market Comp Detail Page,Comparison - Themes,Themes Compared,Market Comp Detail Page- Comparison - Themes- Themes Compared,1 sentence,Identify similar thematic territory shared with the current story.,"Both narratives grapple with questions of authenticity, liberation, and sacrifice in a world mediated by technology.",2
84,Market Comp,Market Comp Detail Page,Comparison - Themes - Themes Compared,Similarities,Market Comp Detail Page- Comparison - Themes - Themes Compared- Similarities,1 sentence,Highlight a key thematic parallel between the stories.,"Each story uses virtual worlds as a metaphor for escapism and self-delusion, asking what it means to live an authentic life.",2
85,Market Comp,Market Comp Detail Page,Comparison - Themes - Themes Compared,Differences,Market Comp Detail Page- Comparison - Themes - Themes Compared- Differences,1 sentence,Identify a major thematic distinction that sets the current story apart.,"While the comp ultimately valorizes the 'real' over the virtual, this story sees both as equally constructed and ripe for subversion.",2
86,Market Comp,Market Comp Detail Page,Comparison - World,World Details,Market Comp Detail Page- Comparison - World- World Details,1 brief paragraph,"Describe the defining elements of the comp's setting, atmosphere, and genre.","Set in a sprawling, neon-soaked megalopolis where the line between the physical and digital is increasingly blurred, the story creates a vivid and immersive cyberpunk world that feels both alien and unnervingly familiar.",2
87,Market Comp,Market Comp Detail Page,Comparison - World,Tone and Style,Market Comp Detail Page- Comparison - World- Tone and Style,1 sentence,Characterize the comp's narrative voice and stylistic flourishes.,"Staccato prose, dense with tech jargon and noirish metaphors, captures the gritty, hyper-adrenalized feel of the setting.",1
88,Market Comp,Market Comp Detail Page,Comparison - World,World Compared,Market Comp Detail Page- Comparison - World- World Compared,1 sentence,Identify similar world-building elements or genre markers shared with the current story.,Both stories unfold against a richly textured dystopian cityscape where advanced tech coexists with crumbling infrastructure and neon-tinged decay.,1
89,Market Comp,Market Comp Detail Page,Comparison - World - World Compared,Similarities,Market Comp Detail Page- Comparison - World - World Compared- Similarities,1 sentence,Highlight a key setting or atmospheric parallel between the stories.,Each world is a study in contrasts - glittering skyscrapers and VR pleasure palaces built on a foundation of poverty and analog squalor.,2
90,Market Comp,Market Comp Detail Page,Comparison - World - World Compared,Differences,Market Comp Detail Page- Comparison - World - World Compared- Differences,1 sentence,Identify a major world-building distinction that sets the current story apart.,"Where the comp's world maintains a clear divide between digital and physical spaces, this story's setting features a more seamless and insidious merging of the two.",2
91,Plot,-,Plot Card,Plot Card Title,-- Plot Card- Plot Card Title,1 brief title,"Name the main event or turning point of the plot point, to orient the writer.",,5
92,Plot,-,Plot Card,Plot Card Summary,-- Plot Card- Plot Card Summary,1 brief sentence,"Summarize the key event and its impact on the story, to trace the narrative arc.",,12
93,Plot,Plot Detail Page - Arc Subpage,,Setup,Plot Detail Page - Arc Subpage- - Setup,1 brief paragraph,Establish the plot's status quo and the protagonist's unfulfilled desires before the inciting incident.,"In a world where emotions are outlawed, the protagonist secretly yearns to feel, setting the stage for their dangerous journey of self-discovery.",3
94,Plot,Plot Detail Page - Arc Subpage,,Inciting Incident,Plot Detail Page - Arc Subpage- - Inciting Incident,1 brief paragraph,Describe the event that disrupts the status quo and drives the main conflict.,The protagonist's chance encounter with a rebel who encourages them to embrace their feelings ignites their quest to overthrow the emotionless regime.,1
95,Plot,Plot Detail Page - Arc Subpage,,Trials and Complications,Plot Detail Page - Arc Subpage- - Trials and Complications,1 brief paragraph,Summarize the escalating obstacles and revelations the plot's protagonist faces on their journey.,"As the protagonist grapples with unfamiliar emotions and the risks of rebellion, they must navigate a budding romance, a betrayal by a trusted friend, and increasingly perilous attempts to subvert the authorities.",4
96,Plot,Plot Detail Page - Arc Subpage,,The Midpoint Twist,Plot Detail Page - Arc Subpage- - The Midpoint Twist,1 brief paragraph,"Reveal the plot's major turning point, which raises the stakes and shifts the protagonist's trajectory.",The protagonist's capture and interrogation by the regime's ruthless enforcer forces them to confront the true depths of their emotional awakening and the personal cost of the rebellion.,2
97,Plot,Plot Detail Page - Arc Subpage,,The Crisis Point,Plot Detail Page - Arc Subpage- - The Crisis Point,1 brief paragraph,"Outline the protagonist's bleakest moment, where all seems lost and they face their greatest fear or failure.","Betrayed by their lover and with the rebellion on the brink of collapse, the protagonist must choose between surrendering their newfound emotions or risking everything for the chance to feel.",4
98,Plot,Plot Detail Page - Arc Subpage,,The Climax,Plot Detail Page - Arc Subpage- - The Climax,1 brief paragraph,Describe the final confrontation that determines the plot's outcome and the protagonist's fate.,"In a daring raid on the regime's headquarters, the protagonist confronts the enforcer in an emotional showdown, using their passion and empathy to expose the bankruptcy of a world without feelings.",5
99,Plot,Plot Detail Page - Arc Subpage,,The Resolution,Plot Detail Page - Arc Subpage- - The Resolution,1 brief paragraph,Show the new status quo and the protagonist's growth or changed circumstances after the climax.,"With the regime toppled and emotions decriminalized, the protagonist helps build a new society that embraces the full spectrum of human experience, forever changed by their journey.",3
100,Plot,Plot Detail Page - Overview Subpage,-,Plot Main Protagonist Purpose,Plot Detail Page - Overview Subpage- -- Plot Main Protagonist Purpose,1 sentence,Articulate the central role or narrative function of the story's main character.,"As a disillusioned knight seeking redemption, the protagonist must confront the dark legacy of his deeds and restore honor to his tarnished name.",1
101,Plot,Plot Detail Page - Overview Subpage,-,Plot Main Protagonist Goal,Plot Detail Page - Overview Subpage- -- Plot Main Protagonist Goal,1 sentence,Identify the primary objective or desire that drives the protagonist's actions.,The protagonist seeks to atone for his past misdeeds by embarking on a perilous quest to recover a sacred relic and return it to its rightful place.,2
102,Plot,Plot Detail Page - Overview Subpage,-,Plot Exploration,Plot Detail Page - Overview Subpage- -- Plot Exploration,1 brief paragraph,"Provide a concise summary of the plot's central conflict, stakes, and arc.","When a disgraced knight is offered a chance at redemption through a dangerous quest, he must navigate treacherous political machinations, confront the ghosts of his past, and decide what price he's willing to pay for honor. As he closes in on the sacred relic, he discovers a web of corruption.",4
103,Progress,Progress Report Detail Page,Report Section,Story Goal Effectiveness,Progress Report Detail Page- Report Section- Story Goal Effectiveness,1 Paragraph,"Assess how well current development is achieving the story's goals so far, to determine next steps.",,15
104,Progress,Progress Report Detail Page,Report Section,Target Audience Effectiveness,Progress Report Detail Page- Report Section- Target Audience Effectiveness,1 Paragraph,"Evaluate how well the story is resonating with the intended audience, to make needed adjustments.",,4
105,Progress,Progress Report Detail Page,Report Section,Market Comp Effectiveness,Progress Report Detail Page- Report Section- Market Comp Effectiveness,1 Paragraph,"Analyze how the story compares to successful similar works, to gauge market potential.",,11
106,Recap,-,Recap Report Section,Character Progress,-- Recap Report Section- Character Progress,1-2 paragraphs,"Synthesize character development so far, to guide next steps and maintain consistency.",,0
107,Recap,-,Recap Report Section,Plot & Theme Progress,-- Recap Report Section- Plot & Theme Progress,1-2 paragraphs,"Assess progress on plot events and thematic resonance, to ensure narrative cohesion.",,0
108,Recap,-,Recap Report Section,Worldbuilding Progress,-- Recap Report Section- Worldbuilding Progress,1-2 paragraphs,"Evaluate establishment of story world details and rules, to create an immersive setting.",,0
109,Recap,-,Recap Report Section,Identity Progress,-- Recap Report Section- Identity Progress,1-2 paragraphs,"Reflect on advancement of writer's voice and goals, to foster creative growth.",,0
110,Season,Season Detail Page,"Header, Season Card",Season Logline,"Season Detail Page- Header, Season Card- Season Logline",1 sentence,"Encapsulate the primary focus and arc of the season, to plan long-term story progression. Spark interest in the story's main character and conflict, to guide development and pitching.",,9
111,Season,Season Goal Page,Season Goal,Season Goal Summary,Season Goal Page- Season Goal- Season Goal Summary,1 sentence to 1 paragraph,"Distill the season's core emotional and intellectual aims, to focus the narrative.",,6
112,Season,Season Goal Page,Season Goal,Season Audience Promise,Season Goal Page- Season Goal- Season Audience Promise,1 paragraph,"Express what the season will make the audience think and feel, to set expectations and test ideas.",,7
113,Sequence,Sequence Detail Page,"Header, Sequence Card",Sequence Type,"Sequence Detail Page- Header, Sequence Card- Sequence Type",1 brief phrase,"Identify the story function of the sequence (e.g. Inciting Incident, Midpoint, etc.), to structure the narrative.",,1
114,Sequence,Sequence Detail Page,"Header, Sequence Card",Sequence Action-based Title,"Sequence Detail Page- Header, Sequence Card- Sequence Action-based Title",1 brief title,"Highlight the main event or turning point of the sequence, to orient the writer.",Walder Frey massacres the Starks,1
115,Sequence,Sequence Detail Page,"Header, Sequence Card",Sequence Purpose,"Sequence Detail Page- Header, Sequence Card- Sequence Purpose",1 sentence,"Express what the sequence needs to accomplish in the overall story, to convey its function.",,5
116,Sequence,Sequence Detail Page,"Header, Sequence Card",Card Summary Audience Reaction,"Sequence Detail Page- Header, Sequence Card- Card Summary Audience Reaction",1 brief sentence,"Describe the intended emotional impact on the audience, to create a compelling experience.",,1
117,Sequence,Sequence Detail Page,Arc Summary,Arc Summary,Sequence Detail Page- Arc Summary- Arc Summary,1 paragraph,"Provide an overview of the sequence's main conflict, character development, and central theme.","In this sequence, the protagonist's investigation leads to a series of narrow escapes, a betrayal by an ally, and a devastating revelation, testing her resilience and resolve to continue fighting for the truth.",6
118,Sequence,Sequence Detail Page,,Goal,Sequence Detail Page- - Goal,1 sentence,Clarify what the protagonist hopes to achieve in this sequence.,Protagonist aims to decrypt the stolen data before the antagonist can use it.,1
119,Sequence,Sequence Detail Page,,Obstacle,Sequence Detail Page- - Obstacle,1 sentence,Identify the main challenge or adversary blocking the protagonist from their goal.,"The encrypted data is booby-trapped, threatening to erase itself if the protagonist makes a mistake.",1
120,Sequence,Sequence Detail Page,,Major Choice,Sequence Detail Page- - Major Choice,1 sentence,Present a key decision that will significantly impact the protagonist and story.,Protagonist must choose between saving the data or rescuing her captured ally.,2
121,Sequence,Sequence Detail Page,,Favorite Moment,Sequence Detail Page- - Favorite Moment,1 sentence,"Spotlight an exciting, emotional, or memorable scene within the sequence. If available, be sure to include the expected reaction from the audience.","The daring airfield escape, where the protagonist outwits her pursuers at the last second.",1
122,Sequence,Sequence Detail Page,,Plot Impact,Sequence Detail Page- - Plot Impact,1 sentence,Convey how the events of this sequence change the direction or raise the stakes of the plot.,"The decrypted data reveals the antagonist's end game, forcing the protagonist to go on the offensive.",1
123,Sequence,Sequence Detail Page,,Character Impact,Sequence Detail Page- - Character Impact,1 sentence,"Show how the sequence's events affect the protagonist's arc, relationships, or inner conflict.",The ally's betrayal leaves the protagonist questioning who she can trust.,1
124,Sequence,Sequence Detail Page,,Audience Learns,Sequence Detail Page- - Audience Learns,1 sentence,"Capture the key information, theme, or emotion conveyed to the audience.",The audience learns the true scope of the conspiracy and the personal toll it's taking on the protagonist.,6
125,Series,Series Detail Page,"Header, Series Card",Series Logline,"Series Detail Page- Header, Series Card- Series Logline",1 sentence,"Distill the main concept and arc of the story unit, to guide development. Spark interest in the story's main character and conflict, to guide development and pitching.",,11
126,Series,Series Goal Page,Series Goal,Series Goal Summary,Series Goal Page- Series Goal- Series Goal Summary,1 sentence to 1 paragraph,"Distill the series' core emotional and intellectual aims, to focus the narrative.",,6
127,Series,Series Goal Page,Series Goal,Series Audience Promise,Series Goal Page- Series Goal- Series Audience Promise,1 paragraph,"Express what the series will make the audience think and feel, to set expectations and test ideas.",,7
128,Setting,-,Setting Card,Setting Card Title,-- Setting Card- Setting Card Title,1 brief title,"Name the primary location or time period of the setting, to establish the story world.",,3
129,Setting,-,Setting Card,Setting Card Summary,-- Setting Card- Setting Card Summary,1 brief sentence,"Describe the key details and mood of the setting, to immerse the writer in the world.",,3
130,Settings,Settings Detail Page,-,Key Locations Item,Settings Detail Page- -- Key Locations Item,1 sentence,Identify a pivotal or iconic location that embodies the story's atmosphere and world.,"The haunted, mist-shrouded ruins of the ancient fortress serve as both a memorable setpiece and a symbol of the kingdom's dark past.",1
131,Settings,Settings Detail Page,-,Key Locations Item - Significance,Settings Detail Page- -- Key Locations Item - Significance,1 sentence,"Explain the location's relevance to the plot, characters, or themes.","The fortress is where the knight's redemption arc reaches its climax, as he confronts the literal and metaphorical ghosts of his past.",2
132,Settings,Settings Detail Page,Details,Time,Settings Detail Page- Details- Time,1 sentence,Establish the story's primary time period or temporal context.,"The story unfolds in a fantastical version of the High Middle Ages, with echoes of the Crusades and the Norman Conquest.",1
133,Settings,Settings Detail Page,Details,Language,Settings Detail Page- Details- Language,1 sentence,Note the presence of any constructed languages or real-world linguistic influences.,"Characters speak in a elevated, faux-medieval English register, with occasional Latin phrases for religious rites and magic spells.",1
134,Settings,Settings Detail Page,Details,Geography,Settings Detail Page- Details- Geography,1 sentence,Describe the defining features of the story's physical landscape and climate.,"A patchwork of dense forests, mist-cloaked mountains, and stark, windswept plains, all dominated by the looming ruins of ancient castles.",4
135,Settings,Settings Detail Page,Society,Cultural Norms,Settings Detail Page- Society- Cultural Norms,1 sentence,Encapsulate the society's shared values and normal behaviors that shape characters.,"Society is structured by rigid hierarchies, fiercely defended honor culture, and unquestioning faith in authority.",1
136,Settings,Settings Detail Page,Society,Cultural Norms - Significance,Settings Detail Page- Society- Cultural Norms - Significance,1 sentence,"Explain how key cultural norms influence character goals, conflicts, or fates.",The knight's secret shame isolates him from the very culture of glory he's desperate to win back through his quest.,1
137,Settings,Settings Detail Page,Society,Social Dynamics,Settings Detail Page- Society- Social Dynamics,1 sentence,Highlight how different groups relate to and perceive each other in the world.,"Tensions simmer between the conquering nobility and the resentful indigenous peasantry, with the clergy serving as uneasy mediators.",1
138,Settings,Settings Detail Page,Society,Social Dynamics - Significance,Settings Detail Page- Society- Social Dynamics - Significance,1 sentence,"Explain how social dynamics affect key relationships, conflicts, or plot points.",The protagonist's unlikely friendship with an oppressed peasant boy both reflects and challenges the era's social barriers.,1
139,Settings,Settings Detail Page,-,Key Historical Event,Settings Detail Page- -- Key Historical Event,1 sentence,Identify a historical event that shapes the story's present and echoes its themes.,"The kingdom was forged through a brutal war of conquest a generation ago, with the sins of the past still haunting the present.",1
140,Settings,Settings Detail Page,-,Key Historical Event - Significance,Settings Detail Page- -- Key Historical Event - Significance,1 sentence,"Explain how the historical event influences characters, conflicts, or themes.",The knight's guilt over his role in the conquest sets up his central conflict and foreshadows the story's examination of inherited trauma.,1
141,Settings,Settings Detail Page,Sensory,Visual,Settings Detail Page- Sensory- Visual,1 sentence,Describe an iconic visual that encapsulates the story's aesthetic and atmosphere.,"A lone knight riding across a bleak, misty moor, his armor tarnished and his banner tattered, the ruins of a great castle looming in the distance.",5
142,Settings,Settings Detail Page,Sensory,Sounds,Settings Detail Page- Sensory- Sounds,1 sentence,Evoke a sound that characterizes the story's world and tone.,"The constant keening of the wind over the moors, punctuated by the ominous thunder of hoofbeats and the distant clash of swords.",2
143,Settings,Settings Detail Page,Sensory,Smells,Settings Detail Page- Sensory- Smells,1 sentence,Conjure a scent that brings the story's setting to life through specific details.,"The earthy musk of damp forest floors mingles with the metallic tang of blood and steel and the cold, sharp scent of coming rain.",2
144,Story,Story Detail Page,Header,Story Logline,Story Detail Page- Header- Story Logline,1 sentence,"Provide a concise, compelling summary of the main story concept to guide development and pitch to others.",,11
145,"Story (aka episode, novel)",Story Goal Page,Story Goal,Story Goal Summary,Story Goal Page- Story Goal- Story Goal Summary,1 sentence to 1 paragraph,"Distill the story's core emotional and intellectual aims, to focus the narrative.",,3
146,"Story (aka episode, novel)",Story Goal Page,Story Goal,Story Audience Promise,Story Goal Page- Story Goal- Story Audience Promise,1 paragraph,"Express what the story will make the audience think and feel, to set expectations and test ideas.",,3
147,Target Audience,Target Audience Detail Page,Audience Likes,Major Likes,Target Audience Detail Page- Audience Likes- Major Likes,1 brief sentence,"Identify the main things this audience enjoys in stories, to incorporate into development.",,1
148,Target Audience,Target Audience Detail Page,Audience Dislikes,Major Dislikes,Target Audience Detail Page- Audience Dislikes- Major Dislikes,1 brief sentence,"Recognize the elements this audience doesn't resonate with, to strategically avoid.",,1
149,Target Audience,Target Audience Detail Page,"Header, Target Audience Card",Target Audience Card Summary,"Target Audience Detail Page- Header, Target Audience Card- Target Audience Card Summary",1 brief sentence,"Capture the key traits and motivations of the target audience, to inform story choices.",,4
150,Target Audience,Target Audience Detail Page,-,Key Aspects of Appeal Item,Target Audience Detail Page- -- Key Aspects of Appeal Item,1 sentence,Highlight the story elements that resonate with the target audience's preferences and expectations.,"The rich, immersive world-building and intricate magic system appeal to fantasy enthusiasts who crave deep lore and inventive new realities.",2
151,Target Audience,Target Audience Detail Page,-,Likes Item,Target Audience Detail Page- -- Likes Item,1 sentence,"Identify specific tropes, themes, or storytelling devices the audience enjoys.","This audience gravitates towards chosen one narratives, found family dynamics, and epic quests with high stakes and clear moral lines.",1
152,Target Audience,Target Audience Detail Page,-,Dislikes Item,Target Audience Detail Page- -- Dislikes Item,1 sentence,Call out elements or approaches that typically turn off or frustrate this audience.,"The target readers have little patience for overly dense prose, meandering plotlines, or protagonists without agency or growth.",1
153,Target Audience,Target Audience Detail Page,-,Interests Positive,Target Audience Detail Page- -- Interests Positive,1-3 words,List the audience's key interest areas that align with the story's content.,"Medieval history, Arthurian legend, high fantasy, world religions",1
154,Target Audience,Target Audience Detail Page,-,Interests Negative,Target Audience Detail Page- -- Interests Negative,1-3 words,Identify subjects or genres the audience tends to avoid or dislike.,"Steampunk, grimdark fantasy, sci-fi elements",1
